{
  "schema_version": 1,
  "node_count": 62,
  "edge_count": 237,
  "scope": "Relations explicitly declared in Zenodo metadata where both endpoints are in the 62-DOI public corpus perimeter.",
  "edges": [
    {
      "source_doi": "10.5281/zenodo.22571928",
      "relation": "isNewVersionOf",
      "target_doi": "10.5281/zenodo.19486305",
      "resource_type": "publication-datapaper",
      "scheme": "doi"
    },
    {
      "source_doi": "10.5281/zenodo.22571928",
      "relation": "references",
      "target_doi": "10.5281/zenodo.17508918",
      "resource_type": "publication-workingpaper",
      "scheme": "doi"
    },
    {
      "source_doi": "10.5281/zenodo.19486305",
      "relation": "references",
      "target_doi": "10.5281/zenodo.17508918",
      "resource_type": "publication-workingpaper",
      "scheme": "doi"
    },
    {
      "source_doi": "10.5281/zenodo.19486305",
      "relation": "isDescribedBy",
      "target_doi": "10.5281/zenodo.17388107",
      "resource_type": "publication-workingpaper",
      "scheme": "doi"
    },
    {
      "source_doi": "10.5281/zenodo.19486305",
      "relation": "isNewVersionOf",
      "target_doi": "10.5281/zenodo.18263105",
      "resource_type": "publication-workingpaper",
      "scheme": "doi"
    },
    {
      "source_doi": "10.5281/zenodo.19486305",
      "relation": "isVersionOf",
      "target_doi": "10.5281/zenodo.19445703",
      "resource_type": "publication-datapaper",
      "scheme": "doi"
    },
    {
      "source_doi": "10.5281/zenodo.19445703",
      "relation": "references",
      "target_doi": "10.5281/zenodo.17508918",
      "resource_type": "publication-workingpaper",
      "scheme": "doi"
    },
    {
      "source_doi": "10.5281/zenodo.19445703",
      "relation": "isDescribedBy",
      "target_doi": "10.5281/zenodo.17388107",
      "resource_type": "publication-workingpaper",
      "scheme": "doi"
    },
    {
      "source_doi": "10.5281/zenodo.19445703",
      "relation": "isNewVersionOf",
      "target_doi": "10.5281/zenodo.18263105",
      "resource_type": "publication-workingpaper",
      "scheme": "doi"
    },
    {
      "source_doi": "10.5281/zenodo.18263105",
      "relation": "references",
      "target_doi": "10.5281/zenodo.17508918",
      "resource_type": "publication-workingpaper",
      "scheme": "doi"
    },
    {
      "source_doi": "10.5281/zenodo.18263105",
      "relation": "isDescribedBy",
      "target_doi": "10.5281/zenodo.17388107",
      "resource_type": "publication-workingpaper",
      "scheme": "doi"
    },
    {
      "source_doi": "10.5281/zenodo.17644322",
      "relation": "isReferencedBy",
      "target_doi": "10.5281/zenodo.17508918",
      "resource_type": "publication-workingpaper",
      "scheme": "doi"
    },
    {
      "source_doi": "10.5281/zenodo.17644322",
      "relation": "isDerivedFrom",
      "target_doi": "10.5281/zenodo.17388107",
      "resource_type": "publication-workingpaper",
      "scheme": "doi"
    },
    {
      "source_doi": "10.5281/zenodo.17562638",
      "relation": "isReferencedBy",
      "target_doi": "10.5281/zenodo.17508918",
      "resource_type": "publication-workingpaper",
      "scheme": "doi"
    },
    {
      "source_doi": "10.5281/zenodo.17562638",
      "relation": "isDerivedFrom",
      "target_doi": "10.5281/zenodo.17388107",
      "resource_type": "publication-workingpaper",
      "scheme": "doi"
    },
    {
      "source_doi": "10.5281/zenodo.22977400",
      "relation": "references",
      "target_doi": "10.5281/zenodo.21830122",
      "resource_type": "publication-report",
      "scheme": "doi"
    },
    {
      "source_doi": "10.5281/zenodo.22977400",
      "relation": "references",
      "target_doi": "10.5281/zenodo.21900984",
      "resource_type": "publication-preprint",
      "scheme": "doi"
    },
    {
      "source_doi": "10.5281/zenodo.22977400",
      "relation": "references",
      "target_doi": "10.5281/zenodo.21579517",
      "resource_type": "software",
      "scheme": "doi"
    },
    {
      "source_doi": "10.5281/zenodo.19277507",
      "relation": "isSupplementedBy",
      "target_doi": "10.5281/zenodo.18479087",
      "resource_type": "publication-workingpaper",
      "scheme": "doi"
    },
    {
      "source_doi": "10.5281/zenodo.19277507",
      "relation": "isSupplementedBy",
      "target_doi": "10.5281/zenodo.17749396",
      "resource_type": "publication-article",
      "scheme": "doi"
    },
    {
      "source_doi": "10.5281/zenodo.19277507",
      "relation": "isSupplementedBy",
      "target_doi": "10.5281/zenodo.18263105",
      "resource_type": "publication-report",
      "scheme": "doi"
    },
    {
      "source_doi": "10.5281/zenodo.19277507",
      "relation": "isSupplementedBy",
      "target_doi": "10.5281/zenodo.18784420",
      "resource_type": "publication-report",
      "scheme": "doi"
    },
    {
      "source_doi": "10.5281/zenodo.19286011",
      "relation": "isSupplementedBy",
      "target_doi": "10.5281/zenodo.18784420",
      "resource_type": "publication-report",
      "scheme": "doi"
    },
    {
      "source_doi": "10.5281/zenodo.19286011",
      "relation": "isSupplementedBy",
      "target_doi": "10.5281/zenodo.19277507",
      "resource_type": "publication-report",
      "scheme": "doi"
    },
    {
      "source_doi": "10.5281/zenodo.19286011",
      "relation": "isSupplementedBy",
      "target_doi": "10.5281/zenodo.18479087",
      "resource_type": "publication-workingpaper",
      "scheme": "doi"
    },
    {
      "source_doi": "10.5281/zenodo.19286011",
      "relation": "isSupplementedBy",
      "target_doi": "10.5281/zenodo.17749396",
      "resource_type": "publication-article",
      "scheme": "doi"
    },
    {
      "source_doi": "10.5281/zenodo.19286011",
      "relation": "isSupplementedBy",
      "target_doi": "10.5281/zenodo.18263105",
      "resource_type": "publication-report",
      "scheme": "doi"
    },
    {
      "source_doi": "10.5281/zenodo.18784420",
      "relation": "isSupplementedBy",
      "target_doi": "10.5281/zenodo.18479087",
      "resource_type": "publication-workingpaper",
      "scheme": "doi"
    },
    {
      "source_doi": "10.5281/zenodo.18784420",
      "relation": "isSupplementedBy",
      "target_doi": "10.5281/zenodo.17749396",
      "resource_type": "publication-article",
      "scheme": "doi"
    },
    {
      "source_doi": "10.5281/zenodo.18784420",
      "relation": "isSupplementedBy",
      "target_doi": "10.5281/zenodo.18263105",
      "resource_type": "publication-report",
      "scheme": "doi"
    },
    {
      "source_doi": "10.5281/zenodo.18784420",
      "relation": "isSupplementedBy",
      "target_doi": "10.5281/zenodo.19277507",
      "resource_type": "publication-report",
      "scheme": "doi"
    },
    {
      "source_doi": "10.5281/zenodo.17614956",
      "relation": "isPartOf",
      "target_doi": "10.5281/zenodo.16987507",
      "resource_type": "publication-workingpaper",
      "scheme": "doi"
    },
    {
      "source_doi": "10.5281/zenodo.17614956",
      "relation": "isPartOf",
      "target_doi": "10.5281/zenodo.17229838",
      "resource_type": "publication-workingpaper",
      "scheme": "doi"
    },
    {
      "source_doi": "10.5281/zenodo.17614956",
      "relation": "isPartOf",
      "target_doi": "10.5281/zenodo.16930038",
      "resource_type": "publication-workingpaper",
      "scheme": "doi"
    },
    {
      "source_doi": "10.5281/zenodo.17614956",
      "relation": "isDerivedFrom",
      "target_doi": "10.5281/zenodo.17604766",
      "resource_type": "publication-workingpaper",
      "scheme": "doi"
    },
    {
      "source_doi": "10.5281/zenodo.17614956",
      "relation": "isPartOf",
      "target_doi": "10.5281/zenodo.17338134",
      "resource_type": "publication-workingpaper",
      "scheme": "doi"
    },
    {
      "source_doi": "10.5281/zenodo.17614956",
      "relation": "isPartOf",
      "target_doi": "10.5281/zenodo.17388107",
      "resource_type": "publication-workingpaper",
      "scheme": "doi"
    },
    {
      "source_doi": "10.5281/zenodo.17614956",
      "relation": "references",
      "target_doi": "10.5281/zenodo.17338134",
      "resource_type": "publication-workingpaper",
      "scheme": "doi"
    },
    {
      "source_doi": "10.5281/zenodo.17614956",
      "relation": "references",
      "target_doi": "10.5281/zenodo.17388107",
      "resource_type": "publication-workingpaper",
      "scheme": "doi"
    },
    {
      "source_doi": "10.5281/zenodo.17614956",
      "relation": "references",
      "target_doi": "10.5281/zenodo.17506787",
      "resource_type": "publication-workingpaper",
      "scheme": "doi"
    },
    {
      "source_doi": "10.5281/zenodo.17614956",
      "relation": "references",
      "target_doi": "10.5281/zenodo.17506548",
      "resource_type": "publication-workingpaper",
      "scheme": "doi"
    },
    {
      "source_doi": "10.5281/zenodo.17614956",
      "relation": "references",
      "target_doi": "10.5281/zenodo.17497812",
      "resource_type": "publication-workingpaper",
      "scheme": "doi"
    },
    {
      "source_doi": "10.5281/zenodo.17614956",
      "relation": "references",
      "target_doi": "10.5281/zenodo.17505326",
      "resource_type": "publication-workingpaper",
      "scheme": "doi"
    },
    {
      "source_doi": "10.5281/zenodo.17614956",
      "relation": "references",
      "target_doi": "10.5281/zenodo.17504130",
      "resource_type": "publication-workingpaper",
      "scheme": "doi"
    },
    {
      "source_doi": "10.5281/zenodo.17614956",
      "relation": "references",
      "target_doi": "10.5281/zenodo.17508918",
      "resource_type": "publication-workingpaper",
      "scheme": "doi"
    },
    {
      "source_doi": "10.5281/zenodo.17614956",
      "relation": "references",
      "target_doi": "10.5281/zenodo.17479146",
      "resource_type": "publication-workingpaper",
      "scheme": "doi"
    },
    {